date,username,to,replies,retweets,favorites,text,geo,mentions,hashtags,id,permalink
11/6/19 5:50,sabrinelubna,AppleTV,0,0,0,u know what.. tfu take it back we don’t want it,,,,1.19196E+18,https://twitter.com/sabrinelubna/status/1191955943682191360
11/6/19 5:50,noraax0,AppleTV,0,0,2,Do y’all have no other ideas ?????,,,,1.19196E+18,https://twitter.com/noraax0/status/1191955933724852224
11/6/19 5:50,eyeuheye,AppleTV,0,1,2,I just wanna know why she was wearing hijab during dinner,,,,1.19196E+18,https://twitter.com/eyeuheye/status/1191955875000438784
11/6/19 5:49,heytheredolilah,AppleTV,0,0,0,"can we please get actual, accurate muslim representation",,,,1.19196E+18,https://twitter.com/heytheredolilah/status/1191955844465860608
11/6/19 5:47,tttaimaa,AppleTV,0,0,1,the way y’all love to paint Muslim women as caged birds held back by their identity is disrespectful both to the women and to the faith. im so tired of seeing this ugly shit. ESPECIALLY told by producers who have never lived these experiences. jada girl????,,,,1.19196E+18,https://twitter.com/tttaimaa/status/1191955355384918017
11/6/19 5:47,AstuantaNiang,AppleTV,0,2,11,"I’m so tired of this narrative SO TIRED. I’m glad that a Muslim woman is being represented somewhere but NOT in this light, it’s like every SINGLE time they’re falling for a white boy and have a fight with their families about the SAME THINGS, can we just have ONE REAL THING PLS",,,,1.19196E+18,https://twitter.com/AstuantaNiang/status/1191955241333334016
11/6/19 5:47,_Muhammad_Ss,,0,0,0,MANNNNN ANOTHER ONEEE? https://twitter.com/AppleTV/status/1191762097740419077,,,,1.19196E+18,https://twitter.com/_Muhammad_Ss/status/1191955193186967552
11/6/19 5:44,joe_teladia,AppleTV,0,0,0,Just stick to making phones please.,,,,1.19195E+18,https://twitter.com/joe_teladia/status/1191954613324406784
11/6/19 5:44,angschuyler,AppleTV,0,0,0,"Man, why can't people cast Muslims for Muslim roles jfc...",,,,1.19195E+18,https://twitter.com/angschuyler/status/1191954592818487299
11/6/19 5:44,haddi__7,AppleTV,0,0,4,"know what else is killing me about this trope? In real life Cody is more than likely xenophobic & islamophobic asf, calls her a towel head and tortures her in school. Idk why y’all think Amerikkka is raising all these nice white boys for brown girls to lose their mind over ",,,,1.19195E+18,https://twitter.com/haddi__7/status/1191954586749329410
11/6/19 5:44,spicebabyout,AppleTV,0,1,6,Here we go again same old shit. Idk why Muslim girls are always shown in the same shitty image and the girl always falls for a bird chested white dude like I’m genuinely sick of it but watch ppl some how romanticize n praise it just like they did with Elite,,,,1.19195E+18,https://twitter.com/spicebabyout/status/1191954555459842048
11/6/19 5:43,Omar_Gaza,AppleTV,2,0,4,The replies to this are epic tho #lol check them out then thank me for making your day.,,,#lol,1.19195E+18,https://twitter.com/Omar_Gaza/status/1191954310827036672
11/6/19 5:42,Omar_Gaza,AppleTV,0,4,11,"This is to those who cheer @netflix &amp; @AppleTV whenever they include Arabs or Muslims when in reality they completely hijacking our narrative into whatever sick false perception they have of us, I hope you are happy.",,@netflix @AppleTV,,1.19195E+18,https://twitter.com/Omar_Gaza/status/1191953867392659458
11/6/19 5:40,SUEmalii,AppleTV,4,0,7,Why do they think we are so desperate to break free from our beliefs,,,,1.19195E+18,https://twitter.com/SUEmalii/status/1191953474352812033
11/6/19 5:40,malihaali__,AppleTV,0,0,2,Wtf did I just watch? How will we have normal representation when stupid shit like this is being made? Colonizers really think we need a white boy to save us? We ain't oppressed and this movie cannot speak for everyone! It's 2019 and ppl still think Islam= oppression. Get out ,,,,1.19195E+18,https://twitter.com/malihaali__/status/1191953449920974848
11/6/19 5:39,a_atibaa,AppleTV,0,1,2,I hate this with a passion,,,,1.19195E+18,https://twitter.com/a_atibaa/status/1191953339644350464
11/6/19 5:39,rainsyed,AppleTV,1,0,1,LORDDDD,,,,1.19195E+18,https://twitter.com/rainsyed/status/1191953185465946121
11/6/19 5:39,AliMaolud1,AppleTV,0,1,6,"There’s a cadre of weak, malleable, bootlickers in the Muslim community who want nothing more than acceptance from their white liberal benefactors who reward them for their sycophancy.",,,,1.19195E+18,https://twitter.com/AliMaolud1/status/1191953153606004737
11/6/19 5:37,fiefahalattas_,AppleTV,0,0,2,nobody wants this FUCK YOU none of us hijabi need a white ass,,,,1.19195E+18,https://twitter.com/fiefahalattas_/status/1191952769537757185
11/6/19 5:37,Sobiaaa04,AppleTV,0,0,6,we don’t need ur yt boys omg,,,,1.19195E+18,https://twitter.com/Sobiaaa04/status/1191952724977487873
11/6/19 5:37,luqmom,AppleTV,0,1,0,"Qiyama is near mb, nai man",,,,1.19195E+18,https://twitter.com/luqmom/status/1191952717930995717
11/6/19 5:36,yohjism,AppleTV,0,0,4,I just wanted a hijabi skateboarder film sigh,,,,1.19195E+18,https://twitter.com/yohjism/status/1191952493036625921
11/6/19 5:36,KhaledOAlq,AppleTV,1,1,7,not a white boy ,,,,1.19195E+18,https://twitter.com/KhaledOAlq/status/1191952484622880770
11/6/19 5:35,episodedergi,,0,1,8,"Sundance Film Festivali'nde büyük övgü alan ""Hala""dan fragman var. Pakistan kökenli 17 yaşındaki Hala'nın ailesi, kültürü, diniyle Amerikan yaşam tarzı arasındaki gelgitlerini anlatan film, 6 Aralık'ta Apple TV Plus'ta #Hala #AppleTVPlus #fragman ",,,#Hala #AppleTVPlus #fragman,1.19195E+18,https://twitter.com/episodedergi/status/1191952297468796928
11/6/19 5:35,intrglacticjoon,AppleTV,7,73,196,when will western media stop portraying muslim girls as oppressed losers w hateful families that need some wh¡te boy to save them it’s such a tired ass trope and literally SO far from the truth,,,,1.19195E+18,https://twitter.com/intrglacticjoon/status/1191952271497744384
11/6/19 5:35,ZYDirar,AppleTV,1,1,17,Of course it can’t be a normal Muslim girl with a normal happy life.. she has to hate her whole ethnicity and religion.. she has to be oppressed by her parents.. life has to be unfair on her.. cuz there just isn’t any happy Muslim women out there bro haha great one.,,,,1.19195E+18,https://twitter.com/ZYDirar/status/1191952134192979968
11/6/19 5:33,helloiammariam,,1,1,5,"I have feelings. I have feelings. I have feelings @AppleTV and I won’t lie, they aren’t positive after watching this trailer. please God WHY. WHY. I don’t think watching this movie will make me feel better about it. https://twitter.com/AppleTV/status/1191762097740419077",,@AppleTV,,1.19195E+18,https://twitter.com/helloiammariam/status/1191951774799847425
11/6/19 5:33,Pak1ramb0,AppleTV,0,0,0,im gonna honor kill someone just to make up for this abomination,,,,1.19195E+18,https://twitter.com/Pak1ramb0/status/1191951683905032193
11/6/19 5:32,jalebaee,AppleTV,0,2,20,Man shut the fuck up im tired,,,,1.19195E+18,https://twitter.com/jalebaee/status/1191951474462515200
11/6/19 5:32,NourMGoda,AppleTV,5,14,62,Where to begin commenting on this triteness? Note @jadapsmith's involvement in this recycled narrative about #Muslim girls. #Islam #Hijab,,@jadapsmith,#Muslim #Islam #Hijab,1.19195E+18,https://twitter.com/NourMGoda/status/1191951461439168516
11/6/19 5:31,shaus_,AppleTV,0,0,1,ffs when will these stupid movie producers understand this is not the representation us Muslim women want.,,,,1.19195E+18,https://twitter.com/shaus_/status/1191951251862368256
11/6/19 5:30,mazharr_01,,0,0,0,Wow so original https://twitter.com/AppleTV/status/1191762097740419077,,,,1.19195E+18,https://twitter.com/mazharr_01/status/1191951090150977537
11/6/19 5:28,yslnaj,AppleTV,1,0,11,when are y’all gonna stop using the hijab as a synonym for oppression,,,,1.19195E+18,https://twitter.com/yslnaj/status/1191950447709433856
11/6/19 5:27,fahm_eeda,AppleTV,2,3,22,"Not even gunna watch the trailer, some one tell me if I'm right? She's oppressed by her scarf and thinks some random white boy is the answer to all her problems?",,,,1.19195E+18,https://twitter.com/fahm_eeda/status/1191950313026134017
11/6/19 5:27,EnsaraSejko,AppleTV,0,0,2,"• stop portraying Muslims as oppressed & Muslim girls as forced to wear the hijab, it’s our choice • not all Muslims are brown. there’s black and white Muslims too. • WHITE EUROPEAN MUSLIMS EXIST. • Muslims are from all races and cultures. • this show shouldn’t be a thing.",,,,1.19195E+18,https://twitter.com/EnsaraSejko/status/1191950249402736640
11/6/19 5:27,officialarabmny,AppleTV,1,1,0,okay but honestly what happened to women empowerment and no man can do more than a woman but apparently that only works when the woman isn’t a POC. get out no man liberates me. i’m not oppressed. and same on these brown ppl for complying to this disgusting narrative.,,,,1.19195E+18,https://twitter.com/officialarabmny/status/1191950116338520064
11/6/19 5:25,omaiirrr,AppleTV,4,0,19,"If Muslim Twitter promises not to attack me, I have some unpopular opinions about this ",,,,1.19195E+18,https://twitter.com/omaiirrr/status/1191949738641367040
11/6/19 5:23,thejericbrual,AppleTV,0,0,0,"Happy for the representation, but the narrative it’s going for seems to be what’s pissing people off about this film. It apparently suffers from white savior syndrome, but I’ll wait until December 6th to judge for myself.",,,,1.19195E+18,https://twitter.com/thejericbrual/status/1191949324516765697
11/6/19 5:23,umalayo,AppleTV,1,0,12,My non celebrity white boy crush was finished at 11. I thank Allah he showed me Anankanthasanmoorthy types after,,,,1.19195E+18,https://twitter.com/umalayo/status/1191949305168506881
11/6/19 5:23,nashitakhandakr,AppleTV,1,3,15,If yall gonna do this shit can U at least stop making the men white ,,,,1.19195E+18,https://twitter.com/nashitakhandakr/status/1191949133671813120
11/6/19 5:21,aishuwu4,AppleTV,1,0,1,bro go eat a fucking ass 99% of hijabi girls ik would never ever disrespect their hijab like that also wouldn’t pine over a white man that UGLY? weird how americans love pushing the narrative that all muslim women are oppressed??,,,,1.19195E+18,https://twitter.com/aishuwu4/status/1191948643898732546
11/6/19 5:20,moonlghtbia,AppleTV,0,0,4,is it just me or do I keep seeing the same “Muslim girl is oppressed and wants to leave her religion” narrative. What the hell?,,,,1.19195E+18,https://twitter.com/moonlghtbia/status/1191948418849136641
11/6/19 5:17,yongenergy,AppleTV,0,0,4,why?,,,,1.19195E+18,https://twitter.com/yongenergy/status/1191947726348570624
11/6/19 5:17,seventy6ixers,AppleTV,0,0,2,i am so sick and tired and bored of this trope. please stop it. no one is asking for this.,,,,1.19195E+18,https://twitter.com/seventy6ixers/status/1191947585185030144
11/6/19 5:16,wolvierines,AppleTV,1,0,5,"can we not symbolise oppression in every live action film or tv series when there's a muslim girl (and boy too) involved? i'm a muslim and this is NOT the way we live. as somebody who wears a hijab no, my parents doesn't lock me inside the house and forbid me from socialising.",,,,1.19195E+18,https://twitter.com/wolvierines/status/1191947444935970816
11/6/19 5:13,Hmmmo_,AppleTV,0,0,4,this is the wackest shit i’ve ever seen hahahahaha,,,,1.19195E+18,https://twitter.com/Hmmmo_/status/1191946798853701635
11/6/19 5:13,AnumImrn,,0,0,7,https://twitter.com/AppleTV/status/1191762097740419077,,,,1.19195E+18,https://twitter.com/AnumImrn/status/1191946785369051141
11/6/19 5:13,tasabdel,AppleTV,0,0,5,Why why why why why why why why,,,,1.19195E+18,https://twitter.com/tasabdel/status/1191946658361286657
11/6/19 5:13,Janab_e_Ali,AppleTV,1,0,2,"LMAO at the replies to this trailer, especially from Muslim women themselves. Hopefully @minhalbaig can make more insightful and original content in the future.",,@minhalbaig,,1.19195E+18,https://twitter.com/Janab_e_Ali/status/1191946631907860481
11/6/19 5:13,Samiras_Empire,AppleTV,0,0,3,What Muslim girl is leading a double life for some white boy???? Who is writing these sorry ass storylines ,,,,1.19195E+18,https://twitter.com/Samiras_Empire/status/1191946600056283138
11/6/19 5:12,AyaAmoud,AppleTV,1,3,11,"I have a lot to say about this. First and foremost, the people in the replies that say that muslim women are not oppressed. They are. Maybe not so much in the U.S anymore, but in the middle east they very much are. So that is a reality to some women out there",,,,1.19195E+18,https://twitter.com/AyaAmoud/status/1191946393344233475
11/6/19 5:11,thefakemuslim,AppleTV,0,4,10,Can y’all ever just make a movie about muslim women who just live normal lives and stop making it seem like all muslim women are oppressed and want to fall in love with white men fuck lmfao,,,,1.19195E+18,https://twitter.com/thefakemuslim/status/1191946179980013568
11/6/19 5:11,NaaKammoto,AppleTV,0,0,0,Iss 2 takkay kay white boy keliye woh ab apni zindagi kharab karein?,,,,1.19195E+18,https://twitter.com/NaaKammoto/status/1191946111793143808
11/6/19 5:10,wajihas35,AppleTV,0,0,4,Man Muslim girls really don’t be wanting a white boy who looks like he smells. Move on please,,,,1.19195E+18,https://twitter.com/wajihas35/status/1191945984928030720
11/6/19 5:10,WallsRunIntoMe,AppleTV,0,0,1,What Muslim woman was on the team of writers for this?,,,,1.19195E+18,https://twitter.com/WallsRunIntoMe/status/1191945878711476225
11/6/19 5:09,infofilm_ch,AppleTV,0,0,0,ابل تنشر اعلان للفلم الذي سيعرض بعد شهر تقريباً على الشبكة #HalaMovie و الذي يتحدث مراهقة تحاول ان تجد نفسها بين عائلتها المسلمة المحافظة و نمط الحياة الغربي في فترة المراهقة,,,#HalaMovie,1.19195E+18,https://twitter.com/infofilm_ch/status/1191945719822901250
11/6/19 5:09,Knewbettersum,AppleTV,0,0,1,Theres at least 3 other shows (that nobody watches) that have this same plot. When are yall gonna show realistic hijabs who dont care about white boys,,,,1.19195E+18,https://twitter.com/Knewbettersum/status/1191945616953413632
11/6/19 5:08,_hadiasae,AppleTV,1,2,9,"Being a hijabi, this genuinely made me so mad, so many things wrong with this",,,,1.19195E+18,https://twitter.com/_hadiasae/status/1191945504520900608
11/6/19 5:08,osman_hibaq,AppleTV,1,0,0,Nobody: Actually not a single person: Not one person: Hollywood: Ah yes an oppressed hijabi with a white savior boy ,,,,1.19195E+18,https://twitter.com/osman_hibaq/status/1191945410597797890
11/6/19 5:07,DulZai_,AppleTV,1,7,37,We damn well know Muslim girls be dating the same looking dudes from the hookah lounge or their cousin Mirwais with the chicken doqaan. Tf is this foreign girl falling for some boinaaka speenay who doesn’t even do istenjah narrative these days Lmao,,,,1.19195E+18,https://twitter.com/DulZai_/status/1191945290460344321
11/6/19 5:07,basedsaffiyah,,0,0,0,please say sike https://twitter.com/AppleTV/status/1191762097740419077,,,,1.19195E+18,https://twitter.com/basedsaffiyah/status/1191945203311108098
11/6/19 5:06,makloubae,AppleTV,0,83,226,when will the media stop portraying muslim women as opressed and needing a wh*te man to save us? please... this is so unrealistic considering we are NOT opressed and wh*te men don’t do anything for us except tell us to go back to our countries,,,,1.19195E+18,https://twitter.com/makloubae/status/1191945011363033089
11/6/19 5:06,memdyBDY,AppleTV,0,0,0,Literally what the hell? What is it with nonMuslims and their fetish over a Muslim girl and their ...???? Ya know what I mean like can y’all stop painting us like Hala LMAO,,,,1.19194E+18,https://twitter.com/memdyBDY/status/1191944994074058752
11/6/19 5:06,imtired1118,AppleTV,1,0,8,"yes the only way to be accepted as a Muslim is to do stuff that we don’t typically do and to be rebellious can y’all please make a movie or show where the Muslim girl doesn’t hate her parents and doesn’t have to saved by a white boy. Can y’all show us doing normal stuff, geez",,,,1.19194E+18,https://twitter.com/imtired1118/status/1191944834950537221
11/6/19 5:06,callmeends,AppleTV,3,8,21,Zionist mind:How can we degenerate Muslim youth? *creates Apple TV* *Makes “Hala” film.”,,,,1.19194E+18,https://twitter.com/callmeends/status/1191944809398882304
11/6/19 5:05,the7alloul,AppleTV,0,0,1,ya3ny yom mayeb2a feeh film 3ala esmy yeb2a el 5ara da?,,,,1.19194E+18,https://twitter.com/the7alloul/status/1191944681178980352
11/6/19 5:04,alhussein5454,AppleTV,1,1,4,Yea I think Im switching to android,,,,1.19194E+18,https://twitter.com/alhussein5454/status/1191944468125093889
11/6/19 5:04,Medina_Talebi,AppleTV,1,0,4,This is literally how fetishization happens.,,,,1.19194E+18,https://twitter.com/Medina_Talebi/status/1191944376081104896
11/6/19 5:00,firdaoszn,AppleTV,0,0,11,Oh brother ,,,,1.19194E+18,https://twitter.com/firdaoszn/status/1191943366466064386
11/6/19 5:00,NabealaS,,0,1,2,the clowns are at it again https://twitter.com/AppleTV/status/1191762097740419077,,,,1.19194E+18,https://twitter.com/NabealaS/status/1191943308035133441
11/6/19 4:59,TheMcBang,AppleTV,1,121,448,These fkn idiots wanna constantly push the narrative of the oppressed Muslim girl who needs to be saved by a white dude who shows her how to live life and honestly not only is it the furthest from the truth but also fkn exhausting and annoying now,,,,1.19194E+18,https://twitter.com/TheMcBang/status/1191943177655197701
11/6/19 4:58,zezeteeze,AppleTV,0,0,0,LMAO WTF,,,,1.19194E+18,https://twitter.com/zezeteeze/status/1191942999267315715
11/6/19 4:58,GWAHAFF,AppleTV,1,2,29,i don’t know a single hijabi who would risk they life for a white boy lmaooo don’t get me started on them hood niggas though ,,,,1.19194E+18,https://twitter.com/GWAHAFF/status/1191942968661422083
11/6/19 4:58,DeeForDysphoria,AppleTV,0,0,2,Can’t we just have a muslim lead role that doesn’t have to go breaking rules for boys?,,,,1.19194E+18,https://twitter.com/DeeForDysphoria/status/1191942820921262080
11/6/19 4:57,hxmdii,,0,1,3,here we go again with this bullshit https://twitter.com/AppleTV/status/1191762097740419077,,,,1.19194E+18,https://twitter.com/hxmdii/status/1191942645905547266
11/6/19 4:57,N7AKhan,AppleTV,0,0,0,How disconnected do you have to be direct and write this.....,,,,1.19194E+18,https://twitter.com/N7AKhan/status/1191942638049615872
11/6/19 4:57,ultsshowki,AppleTV,2,0,1,it’s the same storyline in every movie about a muslim person & it’s not even the reality of most muslim’s lives ,,,,1.19194E+18,https://twitter.com/ultsshowki/status/1191942627056390144
11/6/19 4:56,ohshiiieeet,AppleTV,0,0,0,this makes me wanna puke,,,,1.19194E+18,https://twitter.com/ohshiiieeet/status/1191942408008863745
11/6/19 4:55,wrenavis,AppleTV,0,0,0,"this isn't cute, and it isn't original, so let's not act like it is. you're basically pulling what skam/elite/degrassi/nearly ever goddamn media with Muslim girls does, and that's taking our wonderfully complex lives and ignoring it in lieu of a reductionist love story. no thanks",,,,1.19194E+18,https://twitter.com/wrenavis/status/1191942260319031296
11/6/19 4:55,Syriansweethrt,AppleTV,1,0,5,What an unfortunate name choice ,,,,1.19194E+18,https://twitter.com/Syriansweethrt/status/1191942124079636480
11/6/19 4:53,Navvai,AppleTV,2,2,40,how many times are y’all gonna repackage this some tired old oppressed muslim girl narrative who rebels and kisses white boys and hates her scarf like is it too much to ask for a story of a muslim girl who is comfortable and confident in her identity and faith? we exist. ,,,,1.19194E+18,https://twitter.com/Navvai/status/1191941697615400961
11/6/19 4:52,quesaieda,AppleTV,0,0,5,I honestly don’t understand why a Muslim girl needs a white boy to ‘save’ her in every movie. This is the opposite of feminism,,,,1.19194E+18,https://twitter.com/quesaieda/status/1191941431574908928
11/6/19 4:52,mmdsyd,AppleTV,1,2,9,Oppressed Muslim Girl Struggling With Her Faith Decides To Seek Liberation By Making Out With A White Boy.,,,,1.19194E+18,https://twitter.com/mmdsyd/status/1191941276410753025
11/6/19 4:51,Derpmia,AppleTV,0,0,0,"Are you fucking serious... Why does all so-called Muslim representation is about 'breaking free' as if the religion is bad for us. Mat salleh people man.. encouraging haram acts like dehijabbing, openly gay, kissing scenes?",,,,1.19194E+18,https://twitter.com/Derpmia/status/1191941036723130372
11/6/19 4:49,kitabisundi,AppleTV,0,1,1,"Somebody please tell the west that not all muslims wear hijab. Stop stereotyping us, please.",,,,1.19194E+18,https://twitter.com/kitabisundi/status/1191940699043827712
11/6/19 4:48,untabxo,AppleTV,0,0,2,a muslim woman who rebels against her own culture wowwwwwwww how unexpected please continue to categorise us yay,,,,1.19194E+18,https://twitter.com/untabxo/status/1191940510530834432
11/6/19 4:48,kitabisundi,AppleTV,0,0,0,The only appreciative thing about this series is that sweet sweet authentic urdu accent with no tinge of hindi.,,,,1.19194E+18,https://twitter.com/kitabisundi/status/1191940332834955264
11/6/19 4:46,ahmedmdemirci,AppleTV,0,0,0,Netflix izleyicisi üniversiteye giden kızların bazılarının hayatları böyle oluyor diyebilirim. İnkâr etme de hemen çevreni bir sorgula bakayım haklı mıyım değil miyim...,,,,1.19194E+18,https://twitter.com/ahmedmdemirci/status/1191939851261825024
11/6/19 4:46,kinzashahid,AppleTV,0,0,1,How many times do Muslim girls have to say this is not the representation we want lmao pls stop w this annoying ass narrative,,,,1.19194E+18,https://twitter.com/kinzashahid/status/1191939825655570436
11/6/19 4:46,WalaaYassine,AppleTV,0,0,3,Did she just kiss a white boy? OMGGG NOPEEE BYEEE,,,,1.19194E+18,https://twitter.com/WalaaYassine/status/1191939778360549377
11/6/19 4:45,thousandeyesmp3,AppleTV,2,0,1,i was gonna say something but i don’t think it’s my place to say it as someone who’s not muslim,,,,1.19194E+18,https://twitter.com/thousandeyesmp3/status/1191939664975925248
11/6/19 4:44,bIuerosez,AppleTV,1,4,26,honestly tired of people thinking that when a girl wears the hijab it's only because someone is obliging her when that's not the case for everyone.. and the fact that the film / tv show industry keeps repeating this ugly narrative makes everything worse because people believe it,,,,1.19194E+18,https://twitter.com/bIuerosez/status/1191939500479590400
11/6/19 4:44,Kabuls,AppleTV,1,0,0,Here we go.,,,,1.19194E+18,https://twitter.com/Kabuls/status/1191939403473653760
11/6/19 4:43,abihah13,AppleTV,0,0,2, ,,,,1.19194E+18,https://twitter.com/abihah13/status/1191939220539084800
11/6/19 4:43,Some1TouleenOn,AppleTV,1,0,9,I am SO fucking tired of this “oppressed Muslim girl” narrative.,,,,1.19194E+18,https://twitter.com/Some1TouleenOn/status/1191939053559652352
11/6/19 4:42,zaynub_s,AppleTV,0,0,13,"Oh God, here we go again.",,,,1.19194E+18,https://twitter.com/zaynub_s/status/1191938956126048256
11/6/19 4:42,Gooner_Hakim,AppleTV,0,0,0,They love the narrative a covered girl is oppressed and a non covered girl is free. Loooool,,,,1.19194E+18,https://twitter.com/Gooner_Hakim/status/1191938912417189889
11/6/19 4:42,rahmaaxxx,AppleTV,1,1,15,If I see one more storyline about a hijabi who is oppressed and needs a white man to save her I will literally throw a fit. This crap needs to stop. Just try to produce one realistic storyline that tells stories about a typical Muslim woman. I know tons and most of us are amazing,,,,1.19194E+18,https://twitter.com/rahmaaxxx/status/1191938893442166785
11/6/19 4:41,got_Sugar4U,AppleTV,0,1,6,"They always forcing Muslims girls to suck up white ppl in TV shows like they a caprisun, this getting old",,,,1.19194E+18,https://twitter.com/got_Sugar4U/status/1191938701955391490
11/6/19 4:40,camerouninema,AppleTV,7,9,57,I know my Muslim sisters are tired!!,,,,1.19194E+18,https://twitter.com/camerouninema/status/1191938332550414337
11/6/19 4:39,mzang28,AppleTV,2,23,97,"Why is society so obsessed with the idea of hijabis risking it all for a white boy? We ain't gonna shag ya, luv",,,,1.19194E+18,https://twitter.com/mzang28/status/1191938208562589699
11/6/19 4:39,KhawlaR_,AppleTV,1,0,10,"Too many people don't see anything wrong with this. It's not ""just a movie"" or ""just one story."" Problem is it's the ONLY story painted of Muslim women in mass media.",,,,1.19194E+18,https://twitter.com/KhawlaR_/status/1191938178946654208
11/6/19 4:39,__yumna,,1,0,9,https://twitter.com/AppleTV/status/1191762097740419077,,,,1.19194E+18,https://twitter.com/__yumna/status/1191938067533357057
11/6/19 4:38,nightoscphere,AppleTV,0,0,6,all for a WHITE man?? can we come up with something else PLEASE,,,,1.19194E+18,https://twitter.com/nightoscphere/status/1191937906698575872
11/6/19 4:37,AnfieldGuy57,AppleTV,0,0,0,Oppressed hijabi saved by a white boy. The most original plot ever.,,,,1.19194E+18,https://twitter.com/AnfieldGuy57/status/1191937694818918400
11/6/19 4:36,AlSafwa__,AppleTV,0,0,0,Oh no,,,,1.19194E+18,https://twitter.com/AlSafwa__/status/1191937384402821120
11/6/19 4:36,QAMBARR1,AppleTV,0,0,9,They really out here giving a brown kid a movie about a skateboard like I didn’t just land an Ollie last week,,,,1.19194E+18,https://twitter.com/QAMBARR1/status/1191937290211405824
11/6/19 4:36,blxckswns,AppleTV,6,155,1129,can we come up with any other storyline for movies/tv shows about muslim girls that doesnt just revolve around falling for a white boy and trying to go against her religion? please?,,,,1.19194E+18,https://twitter.com/blxckswns/status/1191937287606681601
11/6/19 4:35,Sacajawea_12,,0,0,0,This movie stank https://twitter.com/AppleTV/status/1191762097740419077,,,,1.19194E+18,https://twitter.com/Sacajawea_12/status/1191937124754501632
11/6/19 4:34,ragadaothman,AppleTV,0,0,6,"As a Muslim girl, i’ll happily slam my tongue on a sliding car door before I let a white boy touch me like that WTFF ",,,,1.19194E+18,https://twitter.com/ragadaothman/status/1191936983448334336
