date,username,to,replies,retweets,favorites,text,geo,mentions,hashtags,id,permalink
11/6/19 23:45,BOQ0RAD,AppleTV,1,0,0,"Hollywood is really only allowing Muslim stories to be told when it is by creators who clearly have unresolved issues about their faith & standing in the western world. Baig & Youssef had a chance to put out something great, instead, we got Hala and Ramy.",,,,1.19223E+18,https://twitter.com/BOQ0RAD/status/1192226528018550789
11/6/19 23:44,HanaZM,AppleTV,0,0,0,Haduu mau merangkul umat islam malah jadi bullyan. Sebule bulenya org gaada tuh sholat rambut sekeliatan begitu,,,,1.19223E+18,https://twitter.com/HanaZM/status/1192226296106897409
11/6/19 23:44,_AqeelAli18_,AppleTV,1,0,0,I wanted to watch this movie so bad when I first heard about it. Then I watched the interview of the writer on Sundance's IG and I became skeptical because it seemed too western. Now the trailer has left a sour taste in the mouth because of the strong white male has come(cont.),,,,1.19223E+18,https://twitter.com/_AqeelAli18_/status/1192226270173528070
11/6/19 23:43,_seokjjnnie,AppleTV,2,0,0,Wonderfully insightfull................ ok...........,,,,1.19223E+18,https://twitter.com/_seokjjnnie/status/1192226106369294336
11/6/19 23:43,HasanBattla,AppleTV,0,0,2,Saw a lot of shit on this and sure it's problematic when there's no other stories of Muslims just being normal but low key I think this isn't bad she wants her parents to be happy but she's confused on what she wants for herself like every other teenager,,,,1.19223E+18,https://twitter.com/HasanBattla/status/1192225965721751552
11/6/19 23:39,Aleena_7,AppleTV,1,0,2,This is the biggest load of Islamophobic bullshit and it's not the first or the second time that this is the narrative assigned to Muslim women in cinema. It's exhausting and we're tired of trying to counter it only to have our work undone like this.,,,,1.19222E+18,https://twitter.com/Aleena_7/status/1192224978474872833
11/6/19 23:38,aamoney__,AppleTV,0,0,0,THIS IS BULLSHIT. If you’re gonna try to represent Muslim females stop with this unrealistic fucking narrative,,,,1.19222E+18,https://twitter.com/aamoney__/status/1192224865706823681
11/6/19 23:36,khaybar628,AppleTV,3,24,67,"This looks fantastic. I absolutely welcome this. So many #Hijabis being triggered by this.. just because YOU haven't experienced this kind of oppression, it doesn't mean it doesn't exist. It DOES exist, and it needs to be addressed instead of just being brushed under the carpet.",,,#Hijabis,1.19222E+18,https://twitter.com/khaybar628/status/1192224300499177472
11/6/19 23:36,6bitsib,,0,0,0,https://twitter.com/AppleTV/status/1191762097740419077,,,,1.19222E+18,https://twitter.com/6bitsib/status/1192224293238853632
11/6/19 23:36,_areesh_,AppleTV,0,3,14,"Our culture is far from perfect but I’ve yet to see a portrayal that gets to the root of the issues and not just a typical, “I like white boy but my parentssss ” like come on, we deserve better than this smh",,,,1.19222E+18,https://twitter.com/_areesh_/status/1192224173357056002
11/6/19 23:34,sahraisha,AppleTV,1,0,2,Girl i-,,,,1.19222E+18,https://twitter.com/sahraisha/status/1192223863515553793
11/6/19 23:33,sasukesosucre,AppleTV,0,0,1,Mdr. Je vais rien dire.,,,,1.19222E+18,https://twitter.com/sasukesosucre/status/1192223516600524800
11/6/19 23:33,ZaynabKAhmed,AppleTV,2,2,14,Maybe one day they’ll make a film where the Muslim woman is happy and content in her religion instead of this repetitive rhetoric that we’re all trapped,,,,1.19222E+18,https://twitter.com/ZaynabKAhmed/status/1192223502130135046
11/6/19 23:32,aya_bdaiwi,AppleTV,1,0,3,The white saviour complex. I am a hijabi woman and I do not need to be ‘freed’. Thank you very much ,,,,1.19222E+18,https://twitter.com/aya_bdaiwi/status/1192223166288011264
11/6/19 23:31,GhaziIsraa,AppleTV,2,35,126,Y’all overly fetishize the hijab and the white man. This is not our narrative and it’s not cute. I am not oppressed. I don’t want to date John. And I’m sick and tired of my faith being synonymous with misery. Get better.,,,,1.19222E+18,https://twitter.com/GhaziIsraa/status/1192222985081495553
11/6/19 23:30,haasanspeaks,AppleTV,0,3,14,I want a movie about how reverts are treated by their family. Can we have that @AppleTV,,@AppleTV,,1.19222E+18,https://twitter.com/haasanspeaks/status/1192222800863465473
11/6/19 23:24,bint_el_kalb,AppleTV,2,0,17,Ok I’m not gonna pretend that there aren’t many Muslim women who do have restricted lives because of oppressive parents but I PROMISE the solution to this very complex cultural issue is NOT some greasy white boy,,,,1.19222E+18,https://twitter.com/bint_el_kalb/status/1192221147473027073
11/6/19 23:22,imlikeT____T,AppleTV,1,0,0,the replies I'm dying,,,,1.19222E+18,https://twitter.com/imlikeT____T/status/1192220669745999872
11/6/19 23:21,anonymouslaila,AppleTV,0,0,0,when people ask me why I think apple is trash this is why,,,,1.19222E+18,https://twitter.com/anonymouslaila/status/1192220458294403073
11/6/19 23:20,sabahat_29,AppleTV,0,1,11,this narrative is so TIREDTTTT i promise you hijabis arent waiting for the first mediocre white boy to show a sign of interest for us to take off our hijab....,,,,1.19222E+18,https://twitter.com/sabahat_29/status/1192220357400371200
11/6/19 23:20,kehIanimuch,AppleTV,2,0,3,white boys saving us muslim girls ,,,,1.19222E+18,https://twitter.com/kehIanimuch/status/1192220169776447488
11/6/19 23:19,TaqeeyahC,AppleTV,0,0,8,Imagine how tired we are.,,,,1.19222E+18,https://twitter.com/TaqeeyahC/status/1192220111404486656
11/6/19 23:19,zaidshakilz,AppleTV,1,3,9,"All I am seeing is white boy, doesn't represent us, when we will get the right representation...etc..why are you dying to get representation by a filthy industry? What about music in it? Mixing with the genders? When did haraam halal became about race? Utter nonsense on MT.",,,,1.19222E+18,https://twitter.com/zaidshakilz/status/1192220014360678400
11/6/19 23:18,starncity,AppleTV,1,0,1,no one asked for this take it back,,,,1.19222E+18,https://twitter.com/starncity/status/1192219665029713920
11/6/19 23:17,starncity,AppleTV,0,0,0,this isn’t it take it back,,,,1.19222E+18,https://twitter.com/starncity/status/1192219477091291137
11/6/19 23:17,itznamira,AppleTV,1,1,10,"Why is ""oppressed hijabi taking off her hijab to get freedom and falling in love with white boy"" the narrative that's always taken when representing muslim women in mainstream media? This is so insulting to muslim girls that wear hijab with pride.",,,,1.19222E+18,https://twitter.com/itznamira/status/1192219389908664320
11/6/19 23:16,TuhfahIsmaaeel,AppleTV,0,0,1,Can y’all just leave muslimahs Alone...also where the black Muslims at. Nothing against my other muslimahs but go this narrative is ass. BLACK MUSLIMS EXCIST CHOOSE ANOTHER STORY LINE AND RACES ,,,,1.19222E+18,https://twitter.com/TuhfahIsmaaeel/status/1192219227517788161
11/6/19 23:16,queenfareeda,AppleTV,0,0,6,even if I WAS oppressed I can tell y’all the white man is the LAST person that gon free me ,,,,1.19222E+18,https://twitter.com/queenfareeda/status/1192219123297726464
11/6/19 23:15,casuallynaval,AppleTV,0,0,0,I have never ever seen a positive representation of a young muslim girl,,,,1.19222E+18,https://twitter.com/casuallynaval/status/1192219039814172675
11/6/19 23:15,vminkook777,AppleTV,0,0,0,"""OriGiNaL""",,,,1.19222E+18,https://twitter.com/vminkook777/status/1192218895031164928
11/6/19 23:14,Ibankhanwrites,AppleTV,0,0,0,"I have seen this movie so many times, it's the reason it's on Apple TV.",,,,1.19222E+18,https://twitter.com/Ibankhanwrites/status/1192218760712794112
11/6/19 23:13,obiprofen,AppleTV,2,0,4,All I want is an episode of Grey’s dedicated to Dr. Qadri but instead we keep getting ex Muslim propaganda,,,,1.19222E+18,https://twitter.com/obiprofen/status/1192218365655420928
11/6/19 23:12,traviss_bott,AppleTV,0,0,4,This is about the stupidest shit I’ve seen all day. I wanna an Android now...,,,,1.19222E+18,https://twitter.com/traviss_bott/status/1192218151649529856
11/6/19 23:11,R7XNR,AppleTV,0,0,0,Dhur halar hala,,,,1.19222E+18,https://twitter.com/R7XNR/status/1192217981188759552
11/6/19 23:10,sofiuhhhhhhh,AppleTV,1,0,4,skating and islam are mutually exclusive ,,,,1.19222E+18,https://twitter.com/sofiuhhhhhhh/status/1192217666494308352
11/6/19 23:10,rozvelona,AppleTV,0,1,1,man fuck off this shit is not it,,,,1.19222E+18,https://twitter.com/rozvelona/status/1192217603583946752
11/6/19 23:09,Nuri_ibrahim,AppleTV,1,0,10,This looks like an interesting movie. People need to calm down. We contain multitudes and can tell all kinds of tales and I hope to see more stories about Muslims emerge from this momentum.,,,,1.19222E+18,https://twitter.com/Nuri_ibrahim/status/1192217422184550401
11/6/19 23:08,goldarabiann,AppleTV,0,0,4,Tjrs un blanc qui vient libérer une musulmane et comme par hasard aprzs devient une hoe et tourne le dos à sa famille mdr les actrices qui acceptent ce rôle je vous respecte même pas un peu,,,,1.19222E+18,https://twitter.com/goldarabiann/status/1192217343063146497
11/6/19 23:08,glazedovereyes_,AppleTV,0,0,0,Lmao put that shit back where it came from we don’t want it,,,,1.19222E+18,https://twitter.com/glazedovereyes_/status/1192217281385943041
11/6/19 23:08,mssmarvels,AppleTV,1,0,5,i really hope this movie isn’t actually what it seems like it is and it turns out that she loves her religion and her culture and that all the stereotypes that seem to be portrayed in this movie are proven wrong because that’s the representation i want as a muslim teen.,,,,1.19222E+18,https://twitter.com/mssmarvels/status/1192217204567298048
11/6/19 23:07,akhivae,AppleTV,0,0,1,Bend it Like Beckham but with skateboarding.,,,,1.19222E+18,https://twitter.com/akhivae/status/1192217015936802818
11/6/19 23:06,IAljazari,AppleTV,1,0,0,People keep saying this was made by white guys fetishizing Muslim women for this as if the inferiority complex isn't fully internalized at this point.,,,,1.19222E+18,https://twitter.com/IAljazari/status/1192216733035220999
11/6/19 23:05,j_deena,AppleTV,0,0,0,Ima say no.....but thanks for trying.,,,,1.19222E+18,https://twitter.com/j_deena/status/1192216365190582273
11/6/19 23:04,JustSomeGuyMann,,0,0,0,https://twitter.com/AppleTV/status/1191762097740419077,,,,1.19222E+18,https://twitter.com/JustSomeGuyMann/status/1192216332080517120
11/6/19 23:04,jannah_malfoy,AppleTV,0,0,0,Astagfirullah,,,,1.19222E+18,https://twitter.com/jannah_malfoy/status/1192216329098412033
11/6/19 23:03,_dreamofnadia,,0,0,0,https://twitter.com/AppleTV/status/1191762097740419077,,,,1.19222E+18,https://twitter.com/_dreamofnadia/status/1192216078514053120
11/6/19 23:03,obiedrakes,AppleTV,0,0,0,Here we go again with the “white savior complex” narrative. FOH,,,,1.19222E+18,https://twitter.com/obiedrakes/status/1192216030199894027
11/6/19 23:03,alinablythes,AppleTV,0,0,5,another oppressed muslim girl falling in love with a white boy whose supposedly meant to save her?? can ya’ll come up with something else !!,,,,1.19222E+18,https://twitter.com/alinablythes/status/1192216029130305547
11/6/19 23:02,Hamnahshake,AppleTV,0,0,0,WHAT THE ACTUAL FUCK,,,,1.19222E+18,https://twitter.com/Hamnahshake/status/1192215679417618433
11/6/19 23:02,marilynsstyle,AppleTV,2,0,11,remember when jack kilmer basically made fun of rivers death....,,,,1.19222E+18,https://twitter.com/marilynsstyle/status/1192215621355921408
11/6/19 23:01,DinaShu03,AppleTV,1,0,1,"I knew what this was as soon as I saw “dutiful daughter.” Let me guess, she feels trapped in her religion and family dynamic so she finds liberation in a white boy who teaches her to be herself by rebelling against her family and religion.",,,,1.19222E+18,https://twitter.com/DinaShu03/status/1192215538132570112
11/6/19 23:00,bigsighlol,AppleTV,0,0,2,Yknw if you’re gnna make us Muslim girls fall in love with a guy blah blah at least make us do it for a good looking one?!,,,,1.19222E+18,https://twitter.com/bigsighlol/status/1192215222842527745
11/6/19 23:00,yohanfIop,AppleTV,0,0,0,this is terrible fuck u,,,,1.19222E+18,https://twitter.com/yohanfIop/status/1192215209655570438
11/6/19 23:00,syazadzul,AppleTV,0,0,0,Wow rated R lg. Please don’t make us look bad. Tgk kissing scene dah tahu dah,,,,1.19222E+18,https://twitter.com/syazadzul/status/1192215114834776065
11/6/19 22:55,UNTaKhan,AppleTV,2,0,3,Another TV show showing hijab as oppressive and degrading lol?,,,,1.19221E+18,https://twitter.com/UNTaKhan/status/1192214029701468165
11/6/19 22:55,mariam__ansar,AppleTV,0,1,8,we really have to start platforming voices and experiences that aren’t proximal to whiteness - that don’t salivate over it or feel a pressure to assimilate at its command. those voices exist. those experiences exist,,,,1.19221E+18,https://twitter.com/mariam__ansar/status/1192214005600776192
11/6/19 22:54,AldjIbrahim,AppleTV,1,0,0,les voile décapotable comme ça il me tue vraiment,,,,1.19221E+18,https://twitter.com/AldjIbrahim/status/1192213802282041352
11/6/19 22:54,_Maro,AppleTV,2,0,0,Curious to know what brown people on my TL think about the trailer to this film and why.,,,,1.19221E+18,https://twitter.com/_Maro/status/1192213774289104896
11/6/19 22:54,Ayub_Sm16,AppleTV,0,0,0, ,,,,1.19221E+18,https://twitter.com/Ayub_Sm16/status/1192213734233706497
11/6/19 22:54,jiminoir_,AppleTV,0,0,0, ,,,,1.19221E+18,https://twitter.com/jiminoir_/status/1192213682144583682
11/6/19 22:53,hashimafzal,AppleTV,0,8,15,"The insane thing about this, is that it is written and directed by ""Minahil Baig"". I'd want to know what prompts film makers of colour to come up with such demeaning and degrading stories?",,,,1.19221E+18,https://twitter.com/hashimafzal/status/1192213565895102464
11/6/19 22:52,we_difficult,AppleTV,0,0,0,"This is why samsung > apple, you apple users helped fund this foolishness just sayin",,,,1.19221E+18,https://twitter.com/we_difficult/status/1192213234763411462
11/6/19 22:52,artmyths,AppleTV,2,0,5,can we get one damn story where a muslim girl doesn't have an identity crisis because of a WHITE BOY please I'm tired,,,,1.19221E+18,https://twitter.com/artmyths/status/1192213222826414080
11/6/19 22:51,deehaw_beniaz,AppleTV,0,0,1,"This is getting so much hate from Muslims. It makes me uncomfortable too, but there is truth to it. There are many girls and boys who feel out of place because of conservative/confused parents. And this is not a western phenomenon. It happens in Muslim countries too.",,,,1.19221E+18,https://twitter.com/deehaw_beniaz/status/1192213064193650688
11/6/19 22:50,fraaz_ahmad,AppleTV,0,1,2,Doesn't do any favours when you got the same old storyline about Muslims being held back by their parents viewpoints and own experiences which leads to the child rebelling and wanting a western and most often haram way of life whilst ditching Islam for it.,,,,1.19221E+18,https://twitter.com/fraaz_ahmad/status/1192212723377070083
11/6/19 22:50,awidgaf,AppleTV,1,3,3,cbon allez vous faire foutre vous aussi,,,,1.19221E+18,https://twitter.com/awidgaf/status/1192212682839117824
11/6/19 22:50,ElegantiaeArbit,AppleTV,1,6,33,"If you’re Muslim and support this, you’re /literally/ cucked",,,,1.19221E+18,https://twitter.com/ElegantiaeArbit/status/1192212651235061766
11/6/19 22:49,mxaifos,AppleTV,0,0,0,bruh,,,,1.19221E+18,https://twitter.com/mxaifos/status/1192212405696249856
11/6/19 22:48,BrokenSpaghetty,AppleTV,0,2,7,"You could have made a movie about how hijabi girls get bullied for no fucking reason, but nahhh:) im a Muslim girl and dont need a white boy to be saved from anything, life is hell not because of some material on our head, but bc white people dont understand it's not a big deal",,,,1.19221E+18,https://twitter.com/BrokenSpaghetty/status/1192212156332355593
11/6/19 22:47,umm_ahaha,AppleTV,0,0,0,making me think I need a white boy,,,,1.19221E+18,https://twitter.com/umm_ahaha/status/1192212001231187968
11/6/19 22:47,mxma75,AppleTV,0,0,0,une série où un white saviour libère une voilée de son oppression ,,,,1.19221E+18,https://twitter.com/mxma75/status/1192211968733728769
11/6/19 22:47,MrThompson007,AppleTV,1,0,3,I blame all the Asian male protagonists that wanted white girls and alcohol,,,,1.19221E+18,https://twitter.com/MrThompson007/status/1192211857521725441
11/6/19 22:46,DMallad13,AppleTV,0,0,0,Ok like seriously remove this. Wtf. #NoThankYou ,,,#NoThankYou,1.19221E+18,https://twitter.com/DMallad13/status/1192211775317565440
11/6/19 22:46,_Paratha,AppleTV,0,0,0,This movie took a big L,,,,1.19221E+18,https://twitter.com/_Paratha/status/1192211615032258562
11/6/19 22:45,JKC0RE,AppleTV,1,0,1,imagine how tired we are,,,,1.19221E+18,https://twitter.com/JKC0RE/status/1192211425781047296
11/6/19 22:44,mevoilelaface,AppleTV,0,0,0,Quel bordel encore,,,,1.19221E+18,https://twitter.com/mevoilelaface/status/1192211247816757251
11/6/19 22:44,1988calum,AppleTV,0,1,1,you guys don’t even know how disrespectful it is that they even had the actor kiss her while she had a hijab on... i’m so so so sick of this ugly ass anti islam narrative. as if because we wear the hijab we need a pretty boy to swoop in and save us.,,,,1.19221E+18,https://twitter.com/1988calum/status/1192211145605746688
11/6/19 22:44,HalaArid,AppleTV,0,1,1,"If a muslim woman wished she would take off her hijab it wouldn't be because she wants approval from men. It's because white people give her a hard time in airports, don't hire her, look at her in disgust, call her names and question everything she does. MAKE A MOVIE ABOUT THAT",,,,1.19221E+18,https://twitter.com/HalaArid/status/1192211120964227072
11/6/19 22:43,bluej_1,AppleTV,0,0,1,I'm waiting for it ,,,,1.19221E+18,https://twitter.com/bluej_1/status/1192210936666509313
11/6/19 22:43,chebaiman,,0,8,43,oh how quickly we forget the golden age of Wattpad https://twitter.com/AppleTV/status/1191762097740419077,,,,1.19221E+18,https://twitter.com/chebaiman/status/1192210892638871553
11/6/19 22:43,Saeedios_,AppleTV,1,0,1,Tf is this ,,,,1.19221E+18,https://twitter.com/Saeedios_/status/1192210863412768768
11/6/19 22:42,theHaalaG,AppleTV,0,2,10,"watch this backfire on them. non muslims will watch this, look into islam, and next thing you know 100 new muslims converted.",,,,1.19221E+18,https://twitter.com/theHaalaG/status/1192210731405578249
11/6/19 22:42,210Ibzzy,AppleTV,0,0,4,Dafuck is going on here ???,,,,1.19221E+18,https://twitter.com/210Ibzzy/status/1192210717027553281
11/6/19 22:42,sidratheveggie,AppleTV,1,0,2,WOOOOW has nobody at apple tv had the crazy thought that.... wait for it.... muslim women CAN choose to be muslim and ACTUALLY like it!! and WITHOUT having to be saved by a mediocre lookin white guy!!!!,,,,1.19221E+18,https://twitter.com/sidratheveggie/status/1192210679178153984
11/6/19 22:42,faizington,AppleTV,0,0,0,what a fucking suprise the typical white saviour (same saviours that colonised half the world) coming to help the “oppressed” muslim women. I rlly fail to understand y people can’t fking get in to their thick skull that hijab is a CHOICE and LIBERATES many women.,,,,1.19221E+18,https://twitter.com/faizington/status/1192210630540976129
11/6/19 22:42,gilbertsblythes,AppleTV,1,2,24,anyways stan kamala khan in the upcoming ms. marvel series she will SAVE THE MUSLIM REPRESENTATION !!!,,,,1.19221E+18,https://twitter.com/gilbertsblythes/status/1192210612258037761
11/6/19 22:42,1988calum,AppleTV,0,0,4,MAN NOT THIS FUCKING SHIT AGAIN !!! HOW MANY TIMES DO WE GOTTA TELL YALL THAT US MUSLIM WOMEN ARE NOT FUCKING OPPRESSED??? AND WE MOST DEFINITELY DO NOT NEED A WHITE MAN TO FREE US!!! AND WE’RE PERFECT WITH OR WITHOUT THE MF HIJAB???,,,,1.19221E+18,https://twitter.com/1988calum/status/1192210574081437702
11/6/19 22:41,the_etheropian,,0,0,0,Why watch this when you can watch videos of @Jamaaad crossing people up for free? https://twitter.com/AppleTV/status/1191762097740419077,,@Jamaaad,,1.19221E+18,https://twitter.com/the_etheropian/status/1192210438341177345
11/6/19 22:41,Serenitiliaaa,AppleTV,1,0,7,Im sorry .. but me fantasize about a non-muslim white man who doesnt do istinja and eats pork? Please dont ever disrespect us like that ever again. You truly wish.,,,,1.19221E+18,https://twitter.com/Serenitiliaaa/status/1192210382624116741
11/6/19 22:41,mishsjjd,AppleTV,0,0,0,what the ACTUAL fuck is this? WE. ARE. NOT. OPPRESSED.,,,,1.19221E+18,https://twitter.com/mishsjjd/status/1192210315167092736
11/6/19 22:40,unhapaxx,AppleTV,2,8,24,Mdr euh ? Le fameux gaulois qui sauve la pauvre voilée de l’oppression wtf ,,,,1.19221E+18,https://twitter.com/unhapaxx/status/1192210153468301313
11/6/19 22:40,sunshineishereX,AppleTV,3,2,7,Why don't movies concern about muslim girls chasing their dreams and being successful instead of always picturing them this way?,,,,1.19221E+18,https://twitter.com/sunshineishereX/status/1192210050909134853
11/6/19 22:39,hudasyed_,AppleTV,1,0,2,Please I beg you no Muslim women does this I promise you stop writing us like we have no freedom. We have so much freedom in our religion,,,,1.19221E+18,https://twitter.com/hudasyed_/status/1192209853617463297
11/6/19 22:39,parrishnpotions,AppleTV,0,0,2,i don’t like judging films before watching them but where the fuck does this narrative come from of the muslim girl falling for the white boy and thus questioning her faith?? most of us don’t even find white boys cute??,,,,1.19221E+18,https://twitter.com/parrishnpotions/status/1192209816086876160
11/6/19 22:38,_khadiza_,AppleTV,0,0,3,uhhhhhhh,,,,1.19221E+18,https://twitter.com/_khadiza_/status/1192209710281302016
11/6/19 22:38,halalsomali,AppleTV,0,0,1,they obsessed with us,,,,1.19221E+18,https://twitter.com/halalsomali/status/1192209583118409728
11/6/19 22:38,abirsan_,AppleTV,0,0,1,Encore ,,,,1.19221E+18,https://twitter.com/abirsan_/status/1192209582170480642
11/6/19 22:35,CCTabet,AppleTV,1,0,0,"Noticed a backlash has ensued, and it just happens to have gone against a (so far well reviewed) film about a Muslim girl after numerous films and TV shows about liberal Muslim men who date outside their religions.",,,,1.19221E+18,https://twitter.com/CCTabet/status/1192209011137040385
11/6/19 22:35,kabuki_eolian,AppleTV,0,0,0,again? a fucking gain?,,,,1.19221E+18,https://twitter.com/kabuki_eolian/status/1192208932057571330
11/6/19 22:35,uncomfvrtable,AppleTV,1,0,1,another thing why do people take on these roles???? if you know Islam you would know that this is all stereotypical. disgusted ,,,,1.19221E+18,https://twitter.com/uncomfvrtable/status/1192208904110956545
11/6/19 22:35,bearkaisoo,AppleTV,0,0,0,"This makes me so angry, I can’t belive ppl let this be filmed :( I hate this oppressed BS they keep putting on us",,,,1.19221E+18,https://twitter.com/bearkaisoo/status/1192208840776962048
11/6/19 22:35,HENNAKOOK,AppleTV,2,0,2,Yo wtf this is kind of insulting,,,,1.19221E+18,https://twitter.com/HENNAKOOK/status/1192208839363330048
11/6/19 22:34,CreativeMaazK,AppleTV,0,0,5,No no no. Simply no.,,,,1.19221E+18,https://twitter.com/CreativeMaazK/status/1192208611658866688
11/6/19 22:33,fuyuhanashi,AppleTV,1,0,2,again a fucking gain nothing new nothing changed same old fucking shit,,,,1.19221E+18,https://twitter.com/fuyuhanashi/status/1192208332343394305
11/6/19 22:30,RedAndre4,AppleTV,0,0,0,"You know brown people also skate, just saying.",,,,1.19221E+18,https://twitter.com/RedAndre4/status/1192207703860367361
11/6/19 22:30,damnitnoel,AppleTV,0,0,9,"how many times are y’all gonna have a muslim girl want to change everything about herself and her beliefs for a white boy, then call it muslim representation. i’m so sick of this",,,,1.19221E+18,https://twitter.com/damnitnoel/status/1192207668565274624
11/6/19 22:28,daddybieberstan,AppleTV,0,0,4,What does this even mean y’all,,,,1.19221E+18,https://twitter.com/daddybieberstan/status/1192207115634429953
11/6/19 22:27,nataston01,AppleTV,0,0,0,delete this shit,,,,1.19221E+18,https://twitter.com/nataston01/status/1192207016694972418
11/6/19 22:26,YaseenYRT,AppleTV,0,0,1,think this moobie is gonna be very good imo,,,,1.19221E+18,https://twitter.com/YaseenYRT/status/1192206772423086081
11/6/19 22:26,ayaspire,AppleTV,2,0,21,Nope still ain’t it. Try again.,,,,1.19221E+18,https://twitter.com/ayaspire/status/1192206564347777024
11/6/19 22:25,hxnjx,AppleTV,0,1,3,"You realise none of these actors are actually Muslim, meaning that: 1, Muslims know that this is the wrong kind of representation and 2, Hollywood knows it too, they’re just ignorant about it",,,,1.19221E+18,https://twitter.com/hxnjx/status/1192206458303201280
11/6/19 22:25,musxva,AppleTV,0,0,0,اوكي..,,,,1.19221E+18,https://twitter.com/musxva/status/1192206457619529731
11/6/19 22:25,vno5hv,AppleTV,1,0,0,OMG THE MOM IS MY MOM,,,,1.19221E+18,https://twitter.com/vno5hv/status/1192206363063140358
11/6/19 22:24,ayeshxs,AppleTV,0,0,0,Same old boring narrative ,,,,1.19221E+18,https://twitter.com/ayeshxs/status/1192206130078003201
11/6/19 22:23,r_alozzi,AppleTV,0,0,18,"me @the muslim writer who created this: sweety...,,,, white people and hollywood still won't love or accept you :):):):)) stop trying to be palatable and wise tf up",,,,1.19221E+18,https://twitter.com/r_alozzi/status/1192205873759870978
11/6/19 22:23,HereisAlla,AppleTV,0,0,0,"why it always has to be a white boy???? Also, this shit ain't original there are 1000000 movies like this. that's why nobody watches you ",,,,1.19221E+18,https://twitter.com/HereisAlla/status/1192205812552339456
11/6/19 22:22,JAYSWlSH,AppleTV,2,0,1,smh this is a disgrace,,,,1.19221E+18,https://twitter.com/JAYSWlSH/status/1192205697364172800
11/6/19 22:22,npc_y,AppleTV,0,0,0,opressed pixie dream girl,,,,1.19221E+18,https://twitter.com/npc_y/status/1192205542099496961
