date,username,to,replies,retweets,favorites,text,geo,mentions,hashtags,id,permalink
11/6/19 15:07,thatoneasiandon,AppleTV,0,0,0,"One reason why I’m not watching shows like Elite, they always have to portray a Muslim girl as someone who is oppressed because of their religion",,,,1.1921E+18,https://twitter.com/thatoneasiandon/status/1192096275967164417
11/6/19 15:07,coldcaselove9,AppleTV,2,0,0,I’m over Western Countries always pointing this negative image about Islam and Muslims. They never show the great side of Islam and Muslims.,,,,1.1921E+18,https://twitter.com/coldcaselove9/status/1192096255557718017
11/6/19 15:07,hintofaith,AppleTV,0,0,0,I don’t mean to speak for all Muslim women but like we don’t fall in love with white boys as much as you all think so like can this stop?,,,,1.1921E+18,https://twitter.com/hintofaith/status/1192096230509142016
11/6/19 15:07,SAPPOROTEA,AppleTV,0,0,0,lmao delete this,,,,1.1921E+18,https://twitter.com/SAPPOROTEA/status/1192096206522114048
11/6/19 15:07,Y33T4J,AppleTV,0,1,0,Can someone please tell me why it’s always the same narrative of a white man freeing the “so called oppressed hijabi”,,,,1.1921E+18,https://twitter.com/Y33T4J/status/1192096139350294533
11/6/19 15:07,maisarah_ag,AppleTV,0,0,0,The fuck is this.,,,,1.1921E+18,https://twitter.com/maisarah_ag/status/1192096074262990849
11/6/19 15:06,A_403Forbidden,AppleTV,0,0,0,We don't need a white man to save us we only need Jutts. Calm tf down colonizers.,,,,1.1921E+18,https://twitter.com/A_403Forbidden/status/1192096016268443648
11/6/19 15:06,universmol,AppleTV,0,0,0,idk what to react..... :/,,,,1.1921E+18,https://twitter.com/universmol/status/1192095893459066880
11/6/19 15:06,Summisid,AppleTV,0,0,0,Proud Android user.I am so happy I didn't spend one penny to an enterprise like this.Such wrong portrayal of Muslim girls. DO NOT EVER ATTACK MY RELIGION LIKE THAT.,,,,1.1921E+18,https://twitter.com/Summisid/status/1192095867315949570
11/6/19 15:05,M_of_starlight,AppleTV,2,0,1,Y A W N,,,,1.1921E+18,https://twitter.com/M_of_starlight/status/1192095773825085441
11/6/19 15:05,shahamfarooq,AppleTV,1,0,7,"Muslims are in the minority, so I doubt the industry cares for the nuances of our values (let alone ‘conservative’ values). But the true reveal is how much these plots/characters comfort the seculars - who are relieved of confusions, reassured that ‘ah, they’re just like us!’",,,,1.1921E+18,https://twitter.com/shahamfarooq/status/1192095711149596673
11/6/19 15:05,No_rraaa,AppleTV,1,3,6,"Tjrs la même chose, le petit blanc qui vient sauver la petite immigrée musulmane opprimée en quête de liberté Ils veulent pas comprendre que c’est pas de la religion qu’on a besoin d’être libérées mais de ces abrutis fermés d’esprits ? Bref jsuis énervée",,,,1.1921E+18,https://twitter.com/No_rraaa/status/1192095639833841665
11/6/19 15:05,brennasjake,AppleTV,0,0,3,this has got to be a fucking joke,,,,1.1921E+18,https://twitter.com/brennasjake/status/1192095558816731136
11/6/19 15:04,theaimiadli,AppleTV,1,0,1,"Why tf hollywood always think Muslim women need white men to ""free"" us...",,,,1.1921E+18,https://twitter.com/theaimiadli/status/1192095490411655168
11/6/19 15:04,AmerAbukhalaff,AppleTV,0,0,1,It’s okay guys it’s on Apple TV no one is going to see it,,,,1.1921E+18,https://twitter.com/AmerAbukhalaff/status/1192095463765413888
11/6/19 15:04,imanmohamed__,AppleTV,0,0,12,I just want to know... who lied and said white boys were the main love interest for Muslim girls?! I JUST WANT TO TALK... oh and y’all can throw the whole film away from now. Nobody is watching that.,,,,1.1921E+18,https://twitter.com/imanmohamed__/status/1192095386866814976
11/6/19 15:04,LaloDagach,AppleTV,1,7,19,This Apple TV film looks interesting. About Desi Muslim American girl growing up in a religiously conservative home with immigrant parents. I look forward to watching it.,,,,1.1921E+18,https://twitter.com/LaloDagach/status/1192095362741354498
11/6/19 15:02,Yahoun3,AppleTV,0,0,0,All hail white savior,,,,1.19209E+18,https://twitter.com/Yahoun3/status/1192094894828994560
11/6/19 14:59,farrahdi0b,AppleTV,2,6,24,1)stop making hijabis oppressed in LITERALLY all movies 2)this is so cliche 3)pretty sure when she loves a white boy her life wont get better 4)its not that deep sweetie stick with making phones,,,,1.19209E+18,https://twitter.com/farrahdi0b/status/1192094125908205568
11/6/19 14:59,nt2000nt,AppleTV,0,0,0,"Tbh, I’m so tired of these kind of shows/movies. ",,,,1.19209E+18,https://twitter.com/nt2000nt/status/1192094114583584770
11/6/19 14:59,FrisseFitz,AppleTV,0,0,1,The right Hating this Muslims,,,,1.19209E+18,https://twitter.com/FrisseFitz/status/1192094090491498496
11/6/19 14:58,francandstein,AppleTV,0,0,0,Attended a screening for this earlier this year. The 'sheltered Muslim girl' meets 'liberating white boy' storyline is TIRED. Its as forced as would expect.,,,,1.19209E+18,https://twitter.com/francandstein/status/1192094017300914176
11/6/19 14:58,MubarratC,AppleTV,0,0,5,I. Am. Tired.,,,,1.19209E+18,https://twitter.com/MubarratC/status/1192093836098572294
11/6/19 14:57,DonnaLayal,AppleTV,0,1,3,us Muslim women are all set! keep ur white boys,,,,1.19209E+18,https://twitter.com/DonnaLayal/status/1192093764950675457
11/6/19 14:57,jo_bahjaj,AppleTV,0,0,1,Ugh,,,,1.19209E+18,https://twitter.com/jo_bahjaj/status/1192093764120195073
11/6/19 14:56,808MAF1A,AppleTV,0,0,1,good thing they put this rubbish on Apple tv who the hell is watching it,,,,1.19209E+18,https://twitter.com/808MAF1A/status/1192093373185835013
11/6/19 14:56,YSheikah,AppleTV,0,0,2,When I tell you I CANT WAIT to write a review of this film ,,,,1.19209E+18,https://twitter.com/YSheikah/status/1192093334803800071
11/6/19 14:55,uforpliktet,AppleTV,0,0,0,Aint this that chinless dude from that indie james franco movie,,,,1.19209E+18,https://twitter.com/uforpliktet/status/1192093213315784705
11/6/19 14:53,Imaad_AwE,AppleTV,0,0,6,Lesson learned. I’m not buying my daughter a skateboard,,,,1.19209E+18,https://twitter.com/Imaad_AwE/status/1192092614457208832
11/6/19 14:53,sumia_ismail,AppleTV,0,0,1,This is the dumbest shit I’ve ever seen wtf,,,,1.19209E+18,https://twitter.com/sumia_ismail/status/1192092601563910144
11/6/19 14:53,IdXhendrix,AppleTV,0,0,3,Why do they always have these crusty white kids “saving” the main Muslims character,,,,1.19209E+18,https://twitter.com/IdXhendrix/status/1192092583117369344
11/6/19 14:52,akinakin0zu,AppleTV,1,0,6,"first of all, not even getting into how offensive this narrative is, but it's also super lazy and overdone. second of all??? sis??? that's the ugliest looking white breadass mf???",,,,1.19209E+18,https://twitter.com/akinakin0zu/status/1192092425604304897
11/6/19 14:52,jjksana,AppleTV,0,0,0,What nonsense is this ,,,,1.19209E+18,https://twitter.com/jjksana/status/1192092404792397824
11/6/19 14:50,tryingbeokay,AppleTV,0,0,0,مره غباء ! ابل وش دعوده؟,,,,1.19209E+18,https://twitter.com/tryingbeokay/status/1192091895742291968
11/6/19 14:50,BengalGalPia,,0,1,4,https://twitter.com/AppleTV/status/1191762097740419077,,,,1.19209E+18,https://twitter.com/BengalGalPia/status/1192091786312900608
11/6/19 14:49,extroverted_cat,AppleTV,0,2,2,"ah yes, a movie about a muslim girl who changed her whole identity and her faith just for a white guy and to ""fit in"" the society from being ""oppressed"". they should watch that Norwegian series SKAM season 4. like seriously, we stan Sana more.",,,,1.19209E+18,https://twitter.com/extroverted_cat/status/1192091704817418241
11/6/19 14:49,zustinsjimin,AppleTV,0,0,0,here yall fawking go again,,,,1.19209E+18,https://twitter.com/zustinsjimin/status/1192091680171794434
11/6/19 14:49,sanxirfan,AppleTV,0,0,7,this is THE DUMBEST THING I HAVE EVER SEEN IN MY LIFE COLONIZERS NEED TO SHUT THE FUCK UP,,,,1.19209E+18,https://twitter.com/sanxirfan/status/1192091629156524035
11/6/19 14:49,King__Jaydn,AppleTV,1,0,0,Must they make Hijabis look depressed in every TV show/movie?,,,,1.19209E+18,https://twitter.com/King__Jaydn/status/1192091604280066048
11/6/19 14:49,sobiah_,AppleTV,0,21,72,"the fact that the media thinks the only Muslims to exist are ones who hate their culture/ religion, hate wearing a hijab, feel trapped and only find white boys attractive? CHANGE THE NARRATIVE",,,,1.19209E+18,https://twitter.com/sobiah_/status/1192091593303613440
11/6/19 14:48,pegasverse,AppleTV,0,0,1,White boys are so charming ,,,,1.19209E+18,https://twitter.com/pegasverse/status/1192091376063631361
11/6/19 14:48,ISOYEON5,AppleTV,1,0,3,I can't believe this is happening if the cast had any real muslims i just wanna say shame on u this is the image they wanna put about muslims a wrong representation of a muslim girl who break free who fucking told u we are locked in a cage!!!! Disgusting,,,,1.19209E+18,https://twitter.com/ISOYEON5/status/1192091368077828096
11/6/19 14:47,laceynoor,AppleTV,0,0,0,"Every young Muslim girl I know has no issue going out, playing sports, and living like any other kid. They’re sure as hell not oppressed.",,,,1.19209E+18,https://twitter.com/laceynoor/status/1192091160744992769
11/6/19 14:47,bitchitsamaud,AppleTV,0,0,0, Niggahs ain watchin dis shit,,,,1.19209E+18,https://twitter.com/bitchitsamaud/status/1192091105183125504
11/6/19 14:47,kashi_mahadev,AppleTV,0,0,0,"Thanks Apple , this looks promising. Look forward to more such progressive content !",,,,1.19209E+18,https://twitter.com/kashi_mahadev/status/1192091036119519232
11/6/19 14:46,SmartWentCray,AppleTV,1,0,3,How original... Don't watch this trash,,,,1.19209E+18,https://twitter.com/SmartWentCray/status/1192090831420903424
11/6/19 14:45,marmuzah,,6,9,43,"Complaining about this trash as some fetish/propaganda from le whiteman (not wrong, such fetishizing is real), but not looking at the director of the film (who was also involved in Ramy): https://twitter.com/AppleTV/status/1191762097740419077",,,,1.19209E+18,https://twitter.com/marmuzah/status/1192090635253297154
11/6/19 14:45,jnoubisarah,AppleTV,1,0,2,Imagine how tired we are of this same played out storyline,,,,1.19209E+18,https://twitter.com/jnoubisarah/status/1192090605591105536
11/6/19 14:45,maaham16__,AppleTV,0,0,0,We don’t need this ,,,,1.19209E+18,https://twitter.com/maaham16__/status/1192090530701815808
11/6/19 14:44,nidalshah,AppleTV,0,0,0,Why’s it always got to be a white guy who saves a Muslim girl from “oppression”,,,,1.19209E+18,https://twitter.com/nidalshah/status/1192090460334022656
11/6/19 14:44,blbryflwr,AppleTV,0,1,1,pk dans les films on dirait on aime pas nos vies ://,,,,1.19209E+18,https://twitter.com/blbryflwr/status/1192090428209844225
11/6/19 14:43,AF22815,AppleTV,0,0,0,I'm loving this already!!!,,,,1.19209E+18,https://twitter.com/AF22815/status/1192090245463863296
11/6/19 14:43,wvhida_,AppleTV,0,2,3,"ne sortez pas le film, merci",,,,1.19209E+18,https://twitter.com/wvhida_/status/1192090118452105216
11/6/19 14:43,falala333,AppleTV,1,0,1,man jada pickett smith is exec producer? i’m disappointed,,,,1.19209E+18,https://twitter.com/falala333/status/1192090101817511936
11/6/19 14:43,bangtnsmaids,AppleTV,0,0,2,y’all so annoying muslim girls don’t even like white boys,,,,1.19209E+18,https://twitter.com/bangtnsmaids/status/1192090083442253824
11/6/19 14:41,ahamfrom72nd,AppleTV,0,0,0,@AppleTV this is stupid,,@AppleTV,,1.19209E+18,https://twitter.com/ahamfrom72nd/status/1192089659238600704
11/6/19 14:41,GMaxSnorlax,AppleTV,1,2,9,yoo so hyped for this. Another movie about out of touch immigrant parents that restrict their child's livelihood through cultural impositions that contradict their inhabitancy in the western world. cant wait to see how this one ends! maybe the parents will accept her? idk,,,,1.19209E+18,https://twitter.com/GMaxSnorlax/status/1192089558961311745
11/6/19 14:41,not_calling,AppleTV,0,0,7,wow!!! never heard this story line before. y’all try so hard to make it seem like muslim women hate their religion and their culture so much that they need a little white boy to come and sweep them off their feet and “save” them. y’all make me sick ,,,,1.19209E+18,https://twitter.com/not_calling/status/1192089552678277121
11/6/19 14:40,ggukiesmile_,AppleTV,0,0,6,Why do everyone think that muslim girls number one interest is christian white boys WE ARE TIRED OF THIS BULLSHIT,,,,1.19209E+18,https://twitter.com/ggukiesmile_/status/1192089314794049537
11/6/19 14:40,qasimmaida,AppleTV,0,0,1,Another one of these. No offense to the actress but this is the same propaganda as all the other ones. Me and my sister skateboard but we never needed a white kid to free us from a thing. But congrats to her becoming an actress.,,,,1.19209E+18,https://twitter.com/qasimmaida/status/1192089268765757440
11/6/19 14:40,jjaehniel,AppleTV,0,0,0,breef,,,,1.19209E+18,https://twitter.com/jjaehniel/status/1192089265460711425
11/6/19 14:38,_Sadiqthe4th,AppleTV,0,0,0, . Story of how a girl left Butter Chicken in search of meat loaf cause of a skateboard,,,,1.19209E+18,https://twitter.com/_Sadiqthe4th/status/1192088968868876289
11/6/19 14:38,peachminster,AppleTV,0,0,0,"This is how western people see muslims: oppressed & waiting for a white boy to save us. sorry but we’re actually strong, independent and FREE",,,,1.19209E+18,https://twitter.com/peachminster/status/1192088795048488960
11/6/19 14:37,itsMoeAlshaikh,AppleTV,1,1,24,Here we go again. The media really gets off at trying to free Muslim hijabi girls from their oppression by putting the whitest boy in their life. Every. Time. LOL. Can a hijabi ever play a role that doesn’t revolve around her hijab?,,,,1.19209E+18,https://twitter.com/itsMoeAlshaikh/status/1192088623400783872
11/6/19 14:36,wholesomereen,AppleTV,0,0,0,im so tired. im so tired. stop,,,,1.19209E+18,https://twitter.com/wholesomereen/status/1192088340507447296
11/6/19 14:36,usel3sswhore,AppleTV,1,0,8,yo fuck the white guy saviour shit but A MUSLIM OR MIDDLE EASTER SKATER GIRL??? FUCK YESSS THIS IS THE REP WE NEED BITCHEZ,,,,1.19209E+18,https://twitter.com/usel3sswhore/status/1192088323562582018
11/6/19 14:35,__adeen,AppleTV,0,0,1,no one asked for this. we want a nav documentary,,,,1.19209E+18,https://twitter.com/__adeen/status/1192088230323200000
11/6/19 14:35,Xo_Mids,AppleTV,1,0,2,I am 100% okay with people being angry at the notion that a Muslim girl is being painted in this light by non-Muslims to further our negative portrayal....BUT at the same time I’m sick of you guys using this as a situation to pretend like every other Muslim GIRL doesn’t face shit,,,,1.19209E+18,https://twitter.com/Xo_Mids/status/1192088227626323969
11/6/19 14:35,k94_abed,AppleTV,0,0,0,ما هذا الخراء؟,,,,1.19209E+18,https://twitter.com/k94_abed/status/1192088113356640256
11/6/19 14:35,Hannah_Limbada,AppleTV,1,5,11,All I want for Christmas is ... a film that doesn’t effing portray the Muslim youth as hating their faith because “it suppresses their true identity” fuck Hollywood man ,,,,1.19209E+18,https://twitter.com/Hannah_Limbada/status/1192088110936535046
11/6/19 14:35,prageuh,AppleTV,0,1,7,when a TV show wants to be woke and diverse but instead reinforces the WRONG sterotypes about muslim women and Islam in general. No one asked for a white savior story.,,,,1.19209E+18,https://twitter.com/prageuh/status/1192088067684913152
11/6/19 14:35,Kidayii,AppleTV,0,0,1,Y'all seriously think hijabis need a white man to always come save the day. ,,,,1.19209E+18,https://twitter.com/Kidayii/status/1192088046000361472
11/6/19 14:35,95lattae,AppleTV,1,6,13,"saw the screening for this already. yah this movie was not it and it disappointed me more knowing a Muslim brown woman made created it. i understand it’s a part of her story, but to share an already stale and redundant narrative ...wish she could have written about something else",,,,1.19209E+18,https://twitter.com/95lattae/status/1192088040249942023
11/6/19 14:35,sailormarx_,AppleTV,0,0,1,imagine how tired we are,,,,1.19209E+18,https://twitter.com/sailormarx_/status/1192088016438939655
11/6/19 14:34,MNazx,AppleTV,0,0,0,@AppleTV seriously fix up! ,,@AppleTV,,1.19209E+18,https://twitter.com/MNazx/status/1192087986969677824
11/6/19 14:34,Jaafxr,AppleTV,0,0,1,Steve jobs would never,,,,1.19209E+18,https://twitter.com/Jaafxr/status/1192087978710986753
11/6/19 14:34,not_manal,AppleTV,1,0,4,hala needs to meet my parents for some time lmfaaaooo,,,,1.19209E+18,https://twitter.com/not_manal/status/1192087916320825346
11/6/19 14:34,theotherjarbu,AppleTV,1,1,1,"This is just a roundabout way of telling the tired, unoriginal, white savior story",,,,1.19209E+18,https://twitter.com/theotherjarbu/status/1192087859626414081
11/6/19 14:34,nuestseulgi,AppleTV,1,0,0,I HAVE NO IDEA ABOUT THE PURPOSE OF THIS MOVIE?????,,,,1.19209E+18,https://twitter.com/nuestseulgi/status/1192087803598761990
11/6/19 14:34,Muneeratu_,AppleTV,1,0,0,Same old nonsensical storyline ,,,,1.19209E+18,https://twitter.com/Muneeratu_/status/1192087746187276288
11/6/19 14:32,wahiduuh,AppleTV,1,0,3,oh my god please don’t release this,,,,1.19209E+18,https://twitter.com/wahiduuh/status/1192087456822255616
11/6/19 14:31,DiscOCianna,AppleTV,1,0,4,There’s definitely something to say about navigation identities and the multiplicity that comes with taking party in any religion or culture with rules........but this shit makes me roll my eyes,,,,1.19209E+18,https://twitter.com/DiscOCianna/status/1192087105419108352
11/6/19 14:31,SP4CEWH0RE,AppleTV,2,0,0,what the fuck is this shit,,,,1.19209E+18,https://twitter.com/SP4CEWH0RE/status/1192087004449837056
11/6/19 14:31,ShalaglagMyLeg,AppleTV,0,0,0,This low-key racist shit right here. Love the white-boy saviour.,,,,1.19209E+18,https://twitter.com/ShalaglagMyLeg/status/1192086999336812544
11/6/19 14:30,faatus_,AppleTV,0,0,1,Lmaoo these people are mad,,,,1.19209E+18,https://twitter.com/faatus_/status/1192086778775318528
11/6/19 14:29,reyum__,AppleTV,0,0,0,Muslim women do not need white men to save them from “oppression” ,,,,1.19209E+18,https://twitter.com/reyum__/status/1192086629252583431
11/6/19 14:29,sayitens,AppleTV,0,0,1,the whole muslim girls are being oppressed constantly and need a man nonetheless a WHITE man to save them from their life is so this narrative is ugly and old i hate white ppl,,,,1.19209E+18,https://twitter.com/sayitens/status/1192086613955895296
11/6/19 14:29,vandynestark,AppleTV,0,0,3,again... again,,,,1.19209E+18,https://twitter.com/vandynestark/status/1192086549791465473
11/6/19 14:29,particularbrady,AppleTV,3,2,14,"I am tired of seeing the same kind of misrepresentation of muslim women in movies and series over and over again. this does nothing good for our community, it will only feed into the stereotypes",,,,1.19209E+18,https://twitter.com/particularbrady/status/1192086485715103745
11/6/19 14:28,Vlirvzv,AppleTV,0,0,0,This film is so much bs. You’re a disgrace to your family if you’re having extra marital relationship with some1 outside your religion. Your mum and dad didn’t bring you to the country just so you lose all the values you were brought up with.,,,,1.19209E+18,https://twitter.com/Vlirvzv/status/1192086461971156995
11/6/19 14:28,MandarineChains,AppleTV,1,0,0,"I don’t know what is this senseless shit? But Muslim women are not oppressed nor do they need us men or any other white men to feel “free”. Stop this bullshit. My religion literally says that us men are women’s servants, and that heaven lies underneath their feet.",,,,1.19209E+18,https://twitter.com/MandarineChains/status/1192086452227760128
11/6/19 14:28,taejinception,AppleTV,1,1,6,"another story about a white saviour freeing an asian woman from her implied backwards culture... wmaf tropes in fiction are always, always corny",,,,1.19209E+18,https://twitter.com/taejinception/status/1192086444950507522
11/6/19 14:28,iQFilmmaker,AppleTV,4,1,5,All we ask for are REAL Muslim stories....that’s it!!!! WTF is this???,,,,1.19209E+18,https://twitter.com/iQFilmmaker/status/1192086406941888513
11/6/19 14:28,Ioonayyxy,AppleTV,1,0,6,ahah the oppressed muslim and the white boy that saves the day and frees her ,,,,1.19209E+18,https://twitter.com/Ioonayyxy/status/1192086402458103808
11/6/19 14:28,sadiiyahhm,AppleTV,0,0,1,I’m so confused as to where y’all got the idea that Muslim girls are even remotely attracted to white boys cause on God I don’t know one hou op me die kak.,,,,1.19209E+18,https://twitter.com/sadiiyahhm/status/1192086247084380160
11/6/19 14:27,2algeritalien,AppleTV,2,1,5,Je déteste ce scénario de la fille musulmane qui tombe love du petit blanc mais c’est impossible psq y’a la dictature religieuse de papa. Puis elle se libère et lui s’énerve. Encore de la propagande pour faire passer l’Islam comme une mauvaise religion. C’est comme Élite.,,,,1.19209E+18,https://twitter.com/2algeritalien/status/1192086193850245121
11/6/19 14:27,lasolax,AppleTV,1,0,0,Les films comme ça j’en peux plus,,,,1.19209E+18,https://twitter.com/lasolax/status/1192086105946034176
11/6/19 14:27,tehseenk98,AppleTV,1,0,37,"Ah yes, finally a movie about my deep muslim desires to f my family and be with a white boy! #relatable",,,#relatable,1.19209E+18,https://twitter.com/tehseenk98/status/1192086027114074114
11/6/19 14:27,ItsMe161_,AppleTV,0,0,0,"I feel like a broken record, but to the Muslims complaining about this... 99% of you asked for this. You demanded representation and what, expected it to just come free? Is there a single depiction of a Muslim woman (or man, thank Ramy!) in Western media that isn't like this?",,,,1.19209E+18,https://twitter.com/ItsMe161_/status/1192085987498741760
11/6/19 14:26,MrjBmg_,AppleTV,1,1,3,I can’t wait for this movie to flop.,,,,1.19209E+18,https://twitter.com/MrjBmg_/status/1192085935367892993
11/6/19 14:26,MuhammadEllahi,AppleTV,0,0,6,No Muslim person thinks like this. This is another way to show Islam as an oppressive religion ,,,,1.19209E+18,https://twitter.com/MuhammadEllahi/status/1192085880586018816
11/6/19 14:25,naimsalie_,AppleTV,0,0,0,Nah,,,,1.19209E+18,https://twitter.com/naimsalie_/status/1192085633617072128
11/6/19 14:25,leena_ghrayeb,AppleTV,0,3,35,"The narrative of a “dutiful daughter” who needs some white boy to save her from oppression is a disgusting and tired one, and honestly reeks of Western colonialism. I have yet to see the life of a Muslim American girl represented accurately in media. Do better.",,,,1.19209E+18,https://twitter.com/leena_ghrayeb/status/1192085628101500928
11/6/19 14:24,baddestpaki,AppleTV,0,0,5,They really thought they did something with this one,,,,1.19209E+18,https://twitter.com/baddestpaki/status/1192085432571453442
11/6/19 14:24,tr_egitimci,AppleTV,2,4,8,"Müslüman Kızın, Amerikalı bir Erkek tarafından ÖZGÜRLEŞTİRİLMESİ konulu bir film çekmişler. Başörtülü Müslüman kız, Amerikalı çocuğa aşık oluyor, sevişiyor, acı çekiyor.. Sinama en büyük silahları, kurşun atmadan öldürüyor. @Mehmet_Ali_ONEL @avmbalci",,@Mehmet_Ali_ONEL @avmbalci,,1.19209E+18,https://twitter.com/tr_egitimci/status/1192085374417428480
11/6/19 14:24,peaceful_6laxk,AppleTV,3,0,5,"Don’t rely on Hollywood to tell your stories. Create your own, Even the shitty ones like RAMY.",,,,1.19209E+18,https://twitter.com/peaceful_6laxk/status/1192085290686599168
11/6/19 14:23,RSyafyah,AppleTV,0,0,0,Just wtf,,,,1.19209E+18,https://twitter.com/RSyafyah/status/1192085133953658880
11/6/19 14:23,afsheennnn,AppleTV,2,0,2,"U know what i dnt understand is instead of pushing their own struggles on to us muslims why dont they do their research, coz if they did they would kno that the struggle that we deal w these days is the five prayers n having a connection w Allah swt not kissing boys n drinking",,,,1.19209E+18,https://twitter.com/afsheennnn/status/1192085083299221505
11/6/19 14:22,istarboy_,AppleTV,0,0,0,What fresh condescending shit is this?,,,,1.19208E+18,https://twitter.com/istarboy_/status/1192084863840669697
11/6/19 14:22,ShamsElberry,AppleTV,0,2,6,Oh i like me a good ol' stereotypic tv show about oppressed muslims. It's been a while since one came out i was actually starting to question western media. I mean there's NO WAY a muslim is happy with their beliefs pffttt fuck this,,,,1.19208E+18,https://twitter.com/ShamsElberry/status/1192084774166372363
11/6/19 14:21,imanshakoor,AppleTV,2,2,33,lmaooo i was gonna audition for this cuz i saw a hijabi role - read it and said nope. PSA: we don’t pine after white boys. leave us tf alone lol. where’s the empowerment? where’s the truth? hijabi women are one of the strongest people i have ever seen. show the positivity pls,,,,1.19208E+18,https://twitter.com/imanshakoor/status/1192084687780483072
11/6/19 14:21,hilmi_n1,AppleTV,0,0,4,Apple should focus on fixing its battery life instead of making shitty movies about Muslim women being oppressed,,,,1.19208E+18,https://twitter.com/hilmi_n1/status/1192084672894951426
11/6/19 14:21,hvvlx,AppleTV,1,0,21,who asked for this??? WHO???,,,,1.19208E+18,https://twitter.com/hvvlx/status/1192084541621653506
11/6/19 14:20,edomagnus,AppleTV,3,1,8,"imagine how tired we are, imagine. im tired of these stereotypes and im tired of people thinking im oppressed with a need of a white boy literally stfu",,,,1.19208E+18,https://twitter.com/edomagnus/status/1192084356602482688
11/6/19 14:18,LiamAzer24,AppleTV,0,1,1,Hala is a skater ?? Why didn’t they cast me as the foken dude. Not this unseasoned geeza.,,,,1.19208E+18,https://twitter.com/LiamAzer24/status/1192083748872962049
11/6/19 14:17,ancienthydra,AppleTV,1,0,0,"NO. Just, NO. So tired of the white saviour trope, so tired of this fetish. UGGGGHHHHHH.",,,,1.19208E+18,https://twitter.com/ancienthydra/status/1192083585135566848
11/6/19 14:15,AlamiIbraheem,AppleTV,0,0,0,Add To watch list ,,,,1.19208E+18,https://twitter.com/AlamiIbraheem/status/1192083065012658177
